{
  "schema_version": 1,
  "revision": "mailmeta_thread_1",
  "total_count": 2,
  "unread_count": 2,
  "items": [
    {
      "project": {"peer_id": "peer_alpha", "registry_slug": "alpha", "display_name": "Alpha"},
      "message_id": "message_reply",
      "thread_id": "thread_exact",
      "in_reply_to": "message_root",
      "sender": {"peer_id": "peer_sender", "display_name": "Sender"},
      "recipient": {"peer_id": "peer_alpha", "display_name": "Alpha"},
      "subject": "Re: exact thread",
      "kind": "response",
      "created_at": "2026-08-16T12:01:00Z",
      "activity_at": "2026-08-16T12:01:00Z",
      "unread": true,
      "receipt": {"revision": 0, "unread": true},
      "actions": []
    },
    {
      "project": {"peer_id": "peer_alpha", "registry_slug": "alpha", "display_name": "Alpha"},
      "message_id": "message_root",
      "thread_id": "thread_exact",
      "sender": {"peer_id": "peer_sender", "display_name": "Sender"},
      "recipient": {"peer_id": "peer_alpha", "display_name": "Alpha"},
      "subject": "Exact thread",
      "kind": "question",
      "created_at": "2026-08-16T12:00:00Z",
      "activity_at": "2026-08-16T12:00:00Z",
      "unread": true,
      "receipt": {"revision": 0, "unread": true},
      "actions": []
    }
  ],
  "page": {"limit": 20, "returned": 2, "has_more": false}
}
